{
  "printspecVersion": "0.1.0",
  "units": "mm",
  "part": {
    "type": "cable_comb",
    "label": "USB cable comb",
    "parameters": {
      "length": 70,
      "width": 18,
      "thickness": 4,
      "slotCount": 5,
      "slotWidth": 5,
      "slotSpacing": 12,
      "slotDepth": 12,
      "cornerRadius": 2
    }
  },
  "print": {
    "intendedMaterial": "PLA",
    "recommendedOrientation": "flat",
    "notes": []
  },
  "metadata": {
    "author": "Invisra",
    "license": "CC0-1.0"
  }
}
