{
  "printspecVersion": "0.1.0",
  "units": "mm",
  "part": {
    "type": "drill_guide",
    "label": "Drill guide",
    "parameters": {
      "length": 80,
      "width": 20,
      "height": 15,
      "holeDiameter": 4,
      "holeCount": 4,
      "holeSpacing": 18,
      "bushingDiameter": 8
    }
  },
  "print": {
    "intendedMaterial": "PLA",
    "recommendedOrientation": "flat",
    "notes": []
  },
  "metadata": {
    "author": "Invisra",
    "license": "CC0-1.0"
  }
}
