{
  "printspecVersion": "0.1.0",
  "units": "mm",
  "part": {
    "type": "l_bracket",
    "label": "Small L bracket",
    "parameters": {
      "legLengthA": 40,
      "legLengthB": 30,
      "width": 20,
      "thickness": 4,
      "rib": {
        "enabled": true,
        "thickness": 3
      }
    }
  },
  "print": {
    "intendedMaterial": "PLA",
    "recommendedOrientation": "flat",
    "notes": []
  },
  "metadata": {
    "author": "Invisra",
    "license": "CC0-1.0"
  }
}
