{
  "printspecVersion": "0.1.0",
  "units": "mm",
  "part": {
    "type": "spacer_block",
    "label": "Four hole spacer block",
    "parameters": {
      "length": 60,
      "width": 30,
      "height": 10,
      "holes": [
        {
          "x": -20,
          "y": -10,
          "diameter": 3,
          "depth": "through"
        },
        {
          "x": 20,
          "y": -10,
          "diameter": 3,
          "depth": "through"
        },
        {
          "x": -20,
          "y": 10,
          "diameter": 3,
          "depth": "through"
        },
        {
          "x": 20,
          "y": 10,
          "diameter": 3,
          "depth": "through"
        }
      ]
    }
  },
  "print": {
    "intendedMaterial": "PLA",
    "recommendedOrientation": "flat",
    "notes": []
  },
  "metadata": {
    "author": "Invisra",
    "license": "CC0-1.0"
  }
}
