{
  "printspecVersion": "0.1.0",
  "units": "mm",
  "part": {
    "type": "simple_lid",
    "label": "Simple lid",
    "parameters": {
      "length": 90,
      "width": 60,
      "thickness": 3,
      "lipHeight": 5,
      "lipClearance": 0.3,
      "holes": [
        {
          "x": -35,
          "y": -20,
          "diameter": 3.2,
          "depth": "through"
        }
      ]
    }
  },
  "print": {
    "intendedMaterial": "PLA",
    "recommendedOrientation": "flat",
    "notes": []
  },
  "metadata": {
    "author": "Invisra",
    "license": "CC0-1.0"
  }
}
