{
  "printspecVersion": "0.1.0",
  "units": "mm",
  "project": {
    "type": "project",
    "label": "Simple enclosure project",
    "description": "Base, lid, and M3 screws.",
    "parts": [
      {
        "id": "base",
        "label": "Generated base",
        "spec": {
          "printspecVersion": "0.1.0",
          "units": "mm",
          "part": {
            "type": "simple_box",
            "label": "Simple electronics box",
            "parameters": {
              "outerLength": 90,
              "outerWidth": 60,
              "outerHeight": 30,
              "wallThickness": 2.4,
              "cornerRadius": 4
            }
          },
          "print": {
            "intendedMaterial": "PLA",
            "recommendedOrientation": "flat",
            "notes": []
          },
          "metadata": {
            "author": "Invisra",
            "license": "CC0-1.0"
          }
        },
        "role": "base",
        "quantity": 1
      },
      {
        "id": "lid",
        "label": "Generated lid",
        "spec": {
          "printspecVersion": "0.1.0",
          "units": "mm",
          "part": {
            "type": "simple_lid",
            "label": "Simple lid",
            "parameters": {
              "length": 90,
              "width": 60,
              "thickness": 3,
              "lipHeight": 5,
              "lipClearance": 0.3,
              "holes": [
                {
                  "x": -35,
                  "y": -20,
                  "diameter": 3.2,
                  "depth": "through"
                }
              ]
            }
          },
          "print": {
            "intendedMaterial": "PLA",
            "recommendedOrientation": "flat",
            "notes": []
          },
          "metadata": {
            "author": "Invisra",
            "license": "CC0-1.0"
          }
        },
        "role": "lid",
        "quantity": 1
      }
    ],
    "hardware": [
      {
        "id": "lid_screws",
        "kind": "socket_head_cap_screw",
        "standard": "metric",
        "size": "M3 x 8 mm",
        "quantity": 4,
        "role": "lid fastener",
        "supplierReferences": [
          {
            "supplier": "mcmaster",
            "partNumber": "91292A112",
            "url": "https://www.mcmaster.com/91292A112/",
            "description": "Example supplier reference only"
          }
        ]
      }
    ],
    "relationships": [
      {
        "type": "fastens",
        "partA": "lid",
        "partB": "base",
        "hardware": "lid_screws",
        "notes": "Four M3 screws fasten the lid."
      }
    ],
    "partcad": {
      "packageName": "simple-enclosure",
      "packageVersion": "0.1.0",
      "description": "Future PartCAD-compatible package metadata."
    }
  },
  "metadata": {
    "author": "Invisra",
    "license": "CC0-1.0"
  }
}
