{
  "printspecVersion": "0.1.0",
  "units": "mm",
  "part": {
    "type": "electronics_standoff",
    "label": "M3 electronics standoff",
    "parameters": {
      "outerDiameter": 7,
      "height": 10,
      "holeDiameter": 3.2,
      "baseDiameter": 10,
      "baseHeight": 2
    }
  },
  "print": {
    "intendedMaterial": "PLA",
    "recommendedOrientation": "flat",
    "notes": []
  },
  "metadata": {
    "author": "Invisra",
    "license": "CC0-1.0"
  }
}
