{
  "printspecVersion": "0.1.0",
  "units": "mm",
  "part": {
    "type": "composable_part",
    "label": "Small Bracket With Ribs",
    "components": [
      {
        "id": "leg_a",
        "kind": "plate",
        "operation": "add",
        "dimensions": {
          "length": 40,
          "width": 20,
          "thickness": 4
        }
      },
      {
        "id": "rib",
        "kind": "rib",
        "operation": "add",
        "dimensions": {
          "length": 20,
          "height": 20,
          "thickness": 3
        }
      }
    ],
    "features": [
      {
        "id": "mount_hole",
        "kind": "hole",
        "target": "leg_a",
        "parameters": {
          "diameter": 3.2
        }
      }
    ]
  },
  "print": {
    "intendedMaterial": "PLA",
    "recommendedOrientation": "flat",
    "notes": []
  },
  "metadata": {
    "author": "Invisra",
    "license": "CC0-1.0"
  }
}
