{
  "printspecVersion": "0.1.0",
  "units": "mm",
  "part": {
    "type": "composable_part",
    "label": "Electronics Base With Standoffs",
    "components": [
      {
        "id": "base",
        "kind": "plate",
        "operation": "add",
        "dimensions": {
          "length": 90,
          "width": 60,
          "thickness": 3
        },
        "materialRole": "body"
      },
      {
        "id": "standoff_a",
        "kind": "boss",
        "operation": "add",
        "dimensions": {
          "diameter": 8,
          "height": 10
        },
        "position": {
          "x": -30,
          "y": -20,
          "z": 3
        },
        "materialRole": "mount"
      }
    ],
    "features": [
      {
        "id": "mount_hole",
        "kind": "hole",
        "target": "base",
        "parameters": {
          "diameter": 3.2
        }
      }
    ]
  },
  "print": {
    "intendedMaterial": "PLA",
    "recommendedOrientation": "flat",
    "notes": []
  },
  "metadata": {
    "author": "Invisra",
    "license": "CC0-1.0"
  }
}
